{
  "schema": "s22-expected/1",
  "id": "H06",
  "tz": "UTC",
  "since": null,
  "until": null,
  "prices": "fixtures/heldout/prices.test.json",
  "tags": [
    "accounting-control"
  ],
  "traps": [
    "out-of-order",
    "split-session",
    "duplicate-copy",
    "repeated-total",
    "last-delta-mismatch",
    "regression-epoch",
    "cached-exceeds-input",
    "tools-mcp"
  ],
  "tokens": {
    "input": "9600",
    "output": "900",
    "cacheWrite5m": "0",
    "cacheWrite1h": "0",
    "cacheRead": "6400"
  },
  "tokensByQuality": {
    "verified": {
      "input": "7000",
      "output": "650",
      "cacheWrite5m": "0",
      "cacheWrite1h": "0",
      "cacheRead": "5000"
    },
    "observed_snapshot": {
      "input": "0",
      "output": "0",
      "cacheWrite5m": "0",
      "cacheWrite1h": "0",
      "cacheRead": "0"
    },
    "observed_epoch": {
      "input": "2600",
      "output": "250",
      "cacheWrite5m": "0",
      "cacheWrite1h": "0",
      "cacheRead": "1400"
    }
  },
  "cost": {
    "knownPico": "16400000000",
    "unknownPriceTokens": {
      "input": "0",
      "output": "0",
      "cacheWrite5m": "0",
      "cacheWrite1h": "0",
      "cacheRead": "0"
    },
    "unknownPriceEvents": {
      "total": 0,
      "byReason": {},
      "byModel": {}
    },
    "complete": true
  },
  "cacheHit": {
    "numerator": "6400",
    "denominator": "16000"
  },
  "events": {
    "total": 5,
    "byQuality": {
      "verified": 3,
      "observed_snapshot": 0,
      "observed_epoch": 2
    },
    "byAgent": {
      "claude": 0,
      "codex": 5
    }
  },
  "modelCalls": 5,
  "turns": {
    "claude": 0,
    "codex": 3
  },
  "tools": {
    "total": 2,
    "byName": {
      "mcp__docs__search": 1,
      "apply_patch": 1
    },
    "byMcpServer": {
      "docs": 1
    }
  },
  "toolResults": {
    "error": 0,
    "ok": 0,
    "unknown": 0
  },
  "retries": 0,
  "retryAmbiguous": 0,
  "unresolved": {
    "codex_total_regressed": 1,
    "codex_cached_exceeds_input": 1
  },
  "skipped": {},
  "counters": {
    "rowsRead": 19,
    "rowsRecognised": 17,
    "ignored_record_kind": 2,
    "duplicate_copy": 1,
    "codex_repeat_total": 1,
    "codex_last_delta_mismatch": 1,
    "baseline_reset_assumed": 1
  },
  "byDay": {
    "2026-10-18": {
      "tokens": {
        "input": "9600",
        "output": "900",
        "cacheWrite5m": "0",
        "cacheWrite1h": "0",
        "cacheRead": "6400"
      },
      "knownPico": "16400000000",
      "events": 5
    }
  },
  "complete": false
}
