{
  "schema": "s22-expected/1",
  "id": "H05",
  "tz": "America/New_York",
  "since": "2026-10-17",
  "until": "2026-10-17",
  "prices": "fixtures/heldout/prices.test.json",
  "tags": [
    "accounting-control"
  ],
  "traps": [
    "inclusive-filter",
    "pre-window-baseline",
    "filtered-diagnostics",
    "civil-day"
  ],
  "tokens": {
    "input": "1500",
    "output": "150",
    "cacheWrite5m": "0",
    "cacheWrite1h": "0",
    "cacheRead": "1000"
  },
  "tokensByQuality": {
    "verified": {
      "input": "1500",
      "output": "150",
      "cacheWrite5m": "0",
      "cacheWrite1h": "0",
      "cacheRead": "1000"
    },
    "observed_snapshot": {
      "input": "0",
      "output": "0",
      "cacheWrite5m": "0",
      "cacheWrite1h": "0",
      "cacheRead": "0"
    },
    "observed_epoch": {
      "input": "0",
      "output": "0",
      "cacheWrite5m": "0",
      "cacheWrite1h": "0",
      "cacheRead": "0"
    }
  },
  "cost": {
    "knownPico": "4900000000",
    "unknownPriceTokens": {
      "input": "0",
      "output": "0",
      "cacheWrite5m": "0",
      "cacheWrite1h": "0",
      "cacheRead": "0"
    },
    "unknownPriceEvents": {
      "total": 0,
      "byReason": {},
      "byModel": {}
    },
    "complete": true
  },
  "cacheHit": {
    "numerator": "1000",
    "denominator": "2500"
  },
  "events": {
    "total": 3,
    "byQuality": {
      "verified": 3,
      "observed_snapshot": 0,
      "observed_epoch": 0
    },
    "byAgent": {
      "claude": 2,
      "codex": 1
    }
  },
  "modelCalls": 3,
  "turns": {
    "claude": 1,
    "codex": 1
  },
  "tools": {
    "total": 0,
    "byName": {},
    "byMcpServer": {}
  },
  "toolResults": {
    "error": 0,
    "ok": 0,
    "unknown": 0
  },
  "retries": 0,
  "retryAmbiguous": 0,
  "unresolved": {},
  "skipped": {},
  "counters": {
    "rowsRead": 16,
    "rowsRecognised": 16,
    "codex_repeat_total": 1
  },
  "byDay": {
    "2026-10-17": {
      "tokens": {
        "input": "1500",
        "output": "150",
        "cacheWrite5m": "0",
        "cacheWrite1h": "0",
        "cacheRead": "1000"
      },
      "knownPico": "4900000000",
      "events": 3
    }
  },
  "complete": true
}
