{
  "schema": "s22-expected/1",
  "id": "D16",
  "tz": "UTC",
  "since": null,
  "until": null,
  "prices": "fixtures/prices.test.json",
  "tags": [],
  "traps": [
    "canonical-retry",
    "no-retry-after-success",
    "subagent-retry-isolation"
  ],
  "tokens": {
    "input": "12",
    "output": "8",
    "cacheWrite5m": "0",
    "cacheWrite1h": "0",
    "cacheRead": "0"
  },
  "tokensByQuality": {
    "verified": {
      "input": "12",
      "output": "8",
      "cacheWrite5m": "0",
      "cacheWrite1h": "0",
      "cacheRead": "0"
    },
    "observed_snapshot": {
      "input": "0",
      "output": "0",
      "cacheWrite5m": "0",
      "cacheWrite1h": "0",
      "cacheRead": "0"
    },
    "observed_epoch": {
      "input": "0",
      "output": "0",
      "cacheWrite5m": "0",
      "cacheWrite1h": "0",
      "cacheRead": "0"
    }
  },
  "cost": {
    "knownPico": "104000000",
    "unknownPriceTokens": {
      "input": "0",
      "output": "0",
      "cacheWrite5m": "0",
      "cacheWrite1h": "0",
      "cacheRead": "0"
    },
    "unknownPriceEvents": {
      "total": 0,
      "byReason": {},
      "byModel": {}
    },
    "complete": true
  },
  "cacheHit": {
    "numerator": "0",
    "denominator": "12"
  },
  "events": {
    "total": 8,
    "byQuality": {
      "verified": 8,
      "observed_snapshot": 0,
      "observed_epoch": 0
    },
    "byAgent": {
      "claude": 8,
      "codex": 0
    }
  },
  "modelCalls": 8,
  "turns": {
    "claude": 0,
    "codex": 0
  },
  "tools": {
    "total": 8,
    "byName": {
      "Read": 4,
      "Write": 3,
      "Search": 1
    },
    "byMcpServer": {}
  },
  "toolResults": {
    "error": 4,
    "ok": 4,
    "unknown": 0
  },
  "retries": 3,
  "retryAmbiguous": 0,
  "unresolved": {},
  "skipped": {},
  "counters": {
    "rowsRead": 16,
    "rowsRecognised": 16
  },
  "byDay": {
    "2026-10-14": {
      "tokens": {
        "input": "12",
        "output": "8",
        "cacheWrite5m": "0",
        "cacheWrite1h": "0",
        "cacheRead": "0"
      },
      "knownPico": "104000000",
      "events": 8
    }
  },
  "complete": true
}
