{
  "schema": "s22-expected/1",
  "id": "D06",
  "tz": "UTC",
  "since": null,
  "until": null,
  "prices": "fixtures/prices.test.json",
  "tags": [
    "accounting-control"
  ],
  "traps": [
    "missing-request-merge",
    "missing-request-conflict",
    "missing-identity"
  ],
  "tokens": {
    "input": "12",
    "output": "8",
    "cacheWrite5m": "0",
    "cacheWrite1h": "0",
    "cacheRead": "0"
  },
  "tokensByQuality": {
    "verified": {
      "input": "12",
      "output": "8",
      "cacheWrite5m": "0",
      "cacheWrite1h": "0",
      "cacheRead": "0"
    },
    "observed_snapshot": {
      "input": "0",
      "output": "0",
      "cacheWrite5m": "0",
      "cacheWrite1h": "0",
      "cacheRead": "0"
    },
    "observed_epoch": {
      "input": "0",
      "output": "0",
      "cacheWrite5m": "0",
      "cacheWrite1h": "0",
      "cacheRead": "0"
    }
  },
  "cost": {
    "knownPico": "104000000",
    "unknownPriceTokens": {
      "input": "0",
      "output": "0",
      "cacheWrite5m": "0",
      "cacheWrite1h": "0",
      "cacheRead": "0"
    },
    "unknownPriceEvents": {
      "total": 0,
      "byReason": {},
      "byModel": {}
    },
    "complete": true
  },
  "cacheHit": {
    "numerator": "0",
    "denominator": "12"
  },
  "events": {
    "total": 5,
    "byQuality": {
      "verified": 5,
      "observed_snapshot": 0,
      "observed_epoch": 0
    },
    "byAgent": {
      "claude": 5,
      "codex": 0
    }
  },
  "modelCalls": 5,
  "turns": {
    "claude": 0,
    "codex": 0
  },
  "tools": {
    "total": 0,
    "byName": {},
    "byMcpServer": {}
  },
  "toolResults": {
    "error": 0,
    "ok": 0,
    "unknown": 0
  },
  "retries": 0,
  "retryAmbiguous": 0,
  "unresolved": {
    "request_id_conflict": 2,
    "no_identity": 1
  },
  "skipped": {},
  "counters": {
    "request_id_missing": 5,
    "request_id_missing_merged": 1,
    "claude_duplicate_rows": 3,
    "rowsRead": 11,
    "rowsRecognised": 11
  },
  "byDay": {
    "2026-10-14": {
      "tokens": {
        "input": "12",
        "output": "8",
        "cacheWrite5m": "0",
        "cacheWrite1h": "0",
        "cacheRead": "0"
      },
      "knownPico": "104000000",
      "events": 5
    }
  },
  "complete": false
}
