{
  "schema": "s22-expected/1",
  "id": "D23",
  "tz": "UTC",
  "since": null,
  "until": null,
  "prices": "fixtures/prices.test.json",
  "tags": [],
  "traps": [
    "very-long-line",
    "invalid-utf8",
    "field-limit"
  ],
  "tokens": {
    "input": "2",
    "output": "1",
    "cacheWrite5m": "1",
    "cacheWrite1h": "2",
    "cacheRead": "3"
  },
  "tokensByQuality": {
    "verified": {
      "input": "2",
      "output": "1",
      "cacheWrite5m": "1",
      "cacheWrite1h": "2",
      "cacheRead": "3"
    },
    "observed_snapshot": {
      "input": "0",
      "output": "0",
      "cacheWrite5m": "0",
      "cacheWrite1h": "0",
      "cacheRead": "0"
    },
    "observed_epoch": {
      "input": "0",
      "output": "0",
      "cacheWrite5m": "0",
      "cacheWrite1h": "0",
      "cacheRead": "0"
    }
  },
  "cost": {
    "knownPico": "28000000",
    "unknownPriceTokens": {
      "input": "0",
      "output": "0",
      "cacheWrite5m": "0",
      "cacheWrite1h": "0",
      "cacheRead": "0"
    },
    "unknownPriceEvents": {
      "total": 0,
      "byReason": {},
      "byModel": {}
    },
    "complete": true
  },
  "cacheHit": {
    "numerator": "3",
    "denominator": "8"
  },
  "events": {
    "total": 1,
    "byQuality": {
      "verified": 1,
      "observed_snapshot": 0,
      "observed_epoch": 0
    },
    "byAgent": {
      "claude": 1,
      "codex": 0
    }
  },
  "modelCalls": 1,
  "turns": {
    "claude": 0,
    "codex": 0
  },
  "tools": {
    "total": 0,
    "byName": {},
    "byMcpServer": {}
  },
  "toolResults": {
    "error": 0,
    "ok": 0,
    "unknown": 0
  },
  "retries": 0,
  "retryAmbiguous": 0,
  "unresolved": {},
  "skipped": {
    "line_too_long": 1,
    "invalid_utf8": 1,
    "field_too_long": 1
  },
  "counters": {
    "rowsRead": 4,
    "rowsRecognised": 1
  },
  "byDay": {
    "2026-10-14": {
      "tokens": {
        "input": "2",
        "output": "1",
        "cacheWrite5m": "1",
        "cacheWrite1h": "2",
        "cacheRead": "3"
      },
      "knownPico": "28000000",
      "events": 1
    }
  },
  "complete": false
}
