{
  "schema": "s22-expected/1",
  "id": "D11",
  "tz": "Asia/Kolkata",
  "since": null,
  "until": null,
  "prices": "fixtures/prices.test.json",
  "tags": [
    "accounting-control"
  ],
  "traps": [
    "civil-day",
    "cache-buckets"
  ],
  "tokens": {
    "input": "6",
    "output": "3",
    "cacheWrite5m": "1",
    "cacheWrite1h": "1",
    "cacheRead": "4"
  },
  "tokensByQuality": {
    "verified": {
      "input": "6",
      "output": "3",
      "cacheWrite5m": "1",
      "cacheWrite1h": "1",
      "cacheRead": "4"
    },
    "observed_snapshot": {
      "input": "0",
      "output": "0",
      "cacheWrite5m": "0",
      "cacheWrite1h": "0",
      "cacheRead": "0"
    },
    "observed_epoch": {
      "input": "0",
      "output": "0",
      "cacheWrite5m": "0",
      "cacheWrite1h": "0",
      "cacheRead": "0"
    }
  },
  "cost": {
    "knownPico": "53000000",
    "unknownPriceTokens": {
      "input": "0",
      "output": "0",
      "cacheWrite5m": "0",
      "cacheWrite1h": "0",
      "cacheRead": "0"
    },
    "unknownPriceEvents": {
      "total": 0,
      "byReason": {},
      "byModel": {}
    },
    "complete": true
  },
  "cacheHit": {
    "numerator": "4",
    "denominator": "12"
  },
  "events": {
    "total": 3,
    "byQuality": {
      "verified": 3,
      "observed_snapshot": 0,
      "observed_epoch": 0
    },
    "byAgent": {
      "claude": 3,
      "codex": 0
    }
  },
  "modelCalls": 3,
  "turns": {
    "claude": 0,
    "codex": 0
  },
  "tools": {
    "total": 0,
    "byName": {},
    "byMcpServer": {}
  },
  "toolResults": {
    "error": 0,
    "ok": 0,
    "unknown": 0
  },
  "retries": 0,
  "retryAmbiguous": 0,
  "unresolved": {},
  "skipped": {},
  "counters": {
    "rowsRead": 3,
    "rowsRecognised": 3
  },
  "byDay": {
    "2026-10-14": {
      "tokens": {
        "input": "2",
        "output": "1",
        "cacheWrite5m": "1",
        "cacheWrite1h": "0",
        "cacheRead": "1"
      },
      "knownPico": "18000000",
      "events": 1
    },
    "2026-10-15": {
      "tokens": {
        "input": "4",
        "output": "2",
        "cacheWrite5m": "0",
        "cacheWrite1h": "1",
        "cacheRead": "3"
      },
      "knownPico": "35000000",
      "events": 2
    }
  },
  "complete": true
}
